{
  "schema_version": 1,
  "product": {
    "slug": "store-vertical-zippe",
    "category": "stores-exterieurs",
    "aliases": ["store-vertical"],
    "manufacturer": "Coublanc Espalis",
    "family": "Store vertical zippe"
  },
  "sources": [
    {
      "label": "Fiche produit LADS",
      "type": "catalog_page",
      "url": "https://www.lesartisansdustore.com/products/5-store-vertical-zippe",
      "publisher": "Les Artisans du Store",
      "confidence": "high"
    },
    {
      "label": "Fiche ADS + PDF Coublanc Espalis",
      "type": "technical_pdf",
      "publisher": "Coublanc Espalis",
      "confidence": "high",
      "notes": "Source utilisee pour les dimensions principales du POC actuel."
    }
  ],
  "technical_data": {
    "source": "Fiche ADS + PDF Coublanc Espalis",
    "width_range": "0,84 a 6 m",
    "max_surface": "15 m2",
    "reference_format": "6 x 2,50 m",
    "reference_width_mm": 6000,
    "reference_height_mm": 2500,
    "coffre_profile_mm": "123 x 171",
    "coulisse_profile_mm": "52 x 41",
    "barre_charge_profile_mm": "114"
  },
  "presets": {
    "layout": "vertical-product-layout",
    "callouts": "vertical-product-callouts"
  },
  "render_options": {
    "accent": "#009e96"
  },
  "canvas": {
    "columns": 64,
    "rows": 38,
    "cell": 120,
    "margin": 60,
    "major_every": 4,
    "radius": 72,
    "snap_unit": 10
  },
  "parts": [
    {
      "id": "coffre",
      "number": "1",
      "label": "Coffre extrude",
      "measurement": "123 x 171 mm",
      "detail": "Profil haut compact reconstruit depuis la coupe cotee du PDF Espalis, avec enveloppe, levres de facade et reperes d'embouts."
    },
    {
      "id": "coulisses",
      "number": "2",
      "label": "Coulisses laterales",
      "measurement": "52 x 41 mm",
      "detail": "Guidage vertical du zip textile. Les deux coulisses partagent le meme etat de surbrillance pour garder la lecture symetrique."
    },
    {
      "id": "toile",
      "number": "3",
      "label": "Toile zippee",
      "measurement": "PVC micro-perfore ou plein",
      "detail": "Surface tendue entre les coulisses. Le format de reference utilise 6 x 2,50 m pour rester coherent avec les 15 m2 maximum."
    },
    {
      "id": "barre-charge",
      "number": "4",
      "label": "Barre de charge",
      "measurement": "Profil 114 mm",
      "detail": "Profil bas qui stabilise la toile et ferme la descente. La cote est reprise comme repere de profil dans le dessin."
    },
    {
      "id": "motorisation",
      "number": "5",
      "label": "Motorisation",
      "measurement": "Somfy selon configuration",
      "detail": "Moteur tubulaire isole en vue eclatee au-dessus du coffre, avec tete moteur et axe d'enroulement separes pour clarifier l'assemblage."
    },
    {
      "id": "supports",
      "number": "6",
      "label": "Supports et pose",
      "measurement": "Fixation facade",
      "detail": "Platines de fixation placees hors du coffre pour montrer la logique de pose et les points d'ancrage principaux."
    }
  ],
  "metrics": [
    {
      "label": "Largeur documentee",
      "value": "0,84 a 6 m",
      "note": "Fiche ADS + PDF Coublanc Espalis"
    },
    {
      "label": "Surface maximale",
      "value": "15 m2",
      "note": "Fiche ADS + PDF Coublanc Espalis"
    },
    {
      "label": "Format POC",
      "value": "6 x 2,50 m",
      "note": "reconstruction proportionnelle 15 m2"
    }
  ],
  "elements": [
    {
      "id": "motorisation",
      "part_id": "motorisation",
      "type": "motor",
      "variant": "tubular",
      "slot": "motor",
      "options": {
        "head_preset": "motor_tubular_head",
        "tube_preset": "motor_tubular_tube",
        "drawing_right": 6550,
        "y": 640,
        "tube_x": 4400,
        "tube_cap_width": 180,
        "marker_gap": 168,
        "hit_x": 4260,
        "hit_y_offset": -40,
        "hit_width": 2580,
        "hit_height": 330,
        "tube_y_offset": 40,
        "solid_profile": "vertical-zippe-motorisation"
      }
    },
    {
      "id": "coffre",
      "part_id": "coffre",
      "type": "housing",
      "variant": "front-coffre",
      "slot": "top-housing",
      "box": { "x": 1020, "y": 1310, "width": 5760, "height": 260, "rx": 38 },
      "options": {
        "preset": "housing_zipped_coffre",
        "marker_gap": 160,
        "hit_inset_x": 120,
        "hit_inset_y": 75,
        "hole_offsets": [488, 712],
        "solid_profile": "vertical-zippe-coffre",
        "style": "front_coffre",
        "points": false
      }
    },
    {
      "id": "toile",
      "part_id": "toile",
      "type": "fabric",
      "variant": "zipped-solid",
      "slot": "fabric",
      "box": { "x": 1260, "y": 1990, "width": 5280, "height": 2040, "rx": 22 },
      "options": {
        "preset": "fabric_zipped",
        "marker_gap": 160,
        "hit_inset_x": 85,
        "hit_inset_y": 55,
        "line_count": 35,
        "tick_step": 2,
        "pattern_id": "vertical-zippe-toile",
        "pattern_style": "solid"
      }
    },
    {
      "id": "coulisses",
      "part_id": "coulisses",
      "type": "rail",
      "variant": "zipped-coulisse-pair",
      "slot": "side-guides",
      "options": {
        "extra_top": 140,
        "extra_bottom": 92,
        "marker_gap": 160,
        "hit_x": 470,
        "hit_y_offset": -75,
        "hit_width": 300,
        "hit_height_extra": 165,
        "solid_profile": "vertical-zippe-coulisses",
        "mirrored": true,
        "attached_to": "toile"
      }
    },
    {
      "id": "barre-charge",
      "part_id": "barre-charge",
      "type": "bar",
      "variant": "zipped-load",
      "slot": "bottom-bar",
      "options": {
        "preset": "bar_zipped_load",
        "hit_inset_x": 50,
        "hit_y_offset": -85,
        "hit_height": 265,
        "marker_offset_x": 120,
        "marker_offset_y": 90,
        "solid_profile": "vertical-zippe-barre-charge",
        "embouts": true,
        "grip": true
      }
    },
    {
      "id": "supports",
      "part_id": "supports",
      "type": "support",
      "variant": "mount-pair",
      "slot": "top-supports",
      "options": {
        "anchor_y": 460,
        "gap": 0,
        "width": 420,
        "height": 320,
        "inset_x": 1240,
        "rx": 42,
        "marker_gap": 158,
        "marker_offset_y": 5,
        "hit_inset_x": 120,
        "hit_inset_y": 50,
        "hit_inset_top": 50,
        "hit_inset_bottom": 60,
        "solid_profile": "vertical-zippe-supports",
        "accent_rows": [
          { "y": 54, "inset_x": 76, "height": 10 },
          { "y": 100, "inset_x": 98, "height": 8 },
          { "y": -100, "inset_x": 98, "height": 8 },
          { "y": -54, "inset_x": 76, "height": 10 }
        ],
        "point_specs": [
          { "x": 210, "y": 160, "radius": 54, "tone": "mid" },
          { "x": 96, "y": 160, "radius": 22 },
          { "x": -96, "y": 160, "radius": 22 }
        ],
        "mirrored": true
      }
    }
  ],
  "groups": [
    {
      "id": "motorisation",
      "element_ids": ["motorisation"],
      "attached": true
    },
    {
      "id": "toile-coulisses",
      "element_ids": ["toile", "coulisses"]
    },
    {
      "id": "coffre-toile-barre",
      "element_ids": ["coffre", "toile", "barre-charge"]
    }
  ],
  "callouts": [
    {
      "part_id": "coffre",
      "marker": { "x": 860, "y": 1440 },
      "placement": "top_housing",
      "label_side": "right",
      "first_length": 225,
      "second_length": 390,
      "text_offset_x": 76
    },
    {
      "part_id": "coulisses",
      "marker": { "x": 410, "y": 2990 },
      "placement": "left_vertical_pair",
      "first_length": 285,
      "second_length": 190
    },
    {
      "part_id": "toile",
      "marker": { "x": 3900, "y": 1830 },
      "placement": "center_fabric",
      "label_side": "right",
      "first_length": 265,
      "second_length": 390,
      "text_offset_x": 76
    },
    {
      "part_id": "barre-charge",
      "marker": { "x": 6900, "y": 4400 },
      "placement": "bottom_bar",
      "first_length": 95,
      "second_length": 500,
      "text_offset_x": -72,
      "text_anchor": "end"
    },
    {
      "part_id": "motorisation",
      "marker": { "x": 6720, "y": 770 },
      "marker_anchor": { "group_id": "motorisation", "side": "right", "gap": 168 },
      "placement": "top_housing",
      "second_length": 380,
      "text_offset_x": -72,
      "text_anchor": "end"
    },
    {
      "part_id": "supports",
      "marker": { "x": 6720, "y": 310 },
      "placement": "top_rail",
      "first_length": 180,
      "text_offset_x": -72,
      "text_anchor": "end"
    }
  ],
  "validation": {
    "require_solid_renderers": true,
    "forbid_raw_svg": true,
    "snap_major_widths": true
  }
}
